<config xmlns="https://www.w3schools.com"
    xmlns:xsi="http://www.w3.org/2001/XMLSchema-instance"
    xsi:schemaLocation="https://www.w3schools.com config.xsd">
    <global>
        <locale>en</locale>
    </global>
    <core>
        <inventory>
            <inventorySlots>20</inventorySlots>
            <maxPlayerWeight>100</maxPlayerWeight>
            <items>
                <item>
                    <name>weapon_pistol</name>
                    <label>Pistola</label>
                    <description>Pistola pium pium</description>
                    <weight>10</weight>
                    <unique>true</unique>
                </item>
                <item>
                    <name>tosti</name>
                    <label>Tostada</label>
                    <description>Tostada de pan</description>
                    <weight>1</weight>
                    <unique>false</unique>
                </item>
                <item>
                    <name>agua</name>
                    <label>Botella de agua</label>
                    <description>Botella de agua</description>
                    <weight>1</weight>
                    <unique>false</unique>
                </item>
                <item>
                    <name>cerveza</name>
                    <label>Cerveza</label>
                    <description>Cerveza</description>
                    <weight>1</weight>
                    <unique>false</unique>
                </item>
                <item>
                    <name>whisky</name>
                    <label>Whisky</label>
                    <description>Whisky</description>
                    <weight>1</weight>
                    <unique>false</unique>
                </item>
                <item>
                    <name>vodka</name>
                    <label>Vodka</label>
                    <description>Vodka</description>
                    <weight>1</weight>
                    <unique>false</unique>
                </item>
                <item>
                    <name>ron</name>
                    <label>Ron</label>
                    <description>Ron</description>
                    <weight>1</weight>
                    <unique>false</unique>
                </item>
                <item>
                    <name>tequila</name>
                    <label>Tequila</label>
                    <description>Tequila</description>
                    <weight>1</weight>
                    <unique>false</unique>
                </item>
                <item>
                    <name>gin</name>
                    <label>Gin</label>
                    <description>Gin</description>
                    <weight>1</weight>
                    <unique>false</unique>
                </item>
                <item>
                    <name>mojito</name>
                    <label>Mojito</label>
                    <description>Mojito</description>
                    <weight>1</weight>
                    <unique>false</unique>
                </item>
                <item>
                    <name>margarita</name>
                    <label>Margarita</label>
                    <description>Margarita</description>
                    <weight>1</weight>
                    <unique>false</unique>
                </item>
                <item>
                    <name>daiquiri</name>
                    <label>Daiquiri</label>
                    <description>Daiquiri</description>
                    <weight>1</weight>
                    <unique>false</unique>
                </item>
                <item>
                    <name>martini</name>
                    <label>Martini</label>
                    <description>Martini</description>
                    <weight>1</weight>
                    <unique>false</unique>
                </item>
                <item>
                    <name>bloodymary</name>
                    <label>Bloody Mary</label>
                    <description>Bloody Mary</description>
                    <weight>1</weight>
                    <unique>false</unique>
                </item>
            </items>
        </inventory>
    </core>
</config>